{
  "$schema": "./language.schema.json",
  "code": "en",
  "name": "English",
  "stopwords": [
    "the",
    "a",
    "an",
    "if",
    "and",
    "or",
    "but",
    "this",
    "that",
    "these",
    "those",
    "i",
    "you",
    "he",
    "she",
    "they",
    "it",
    "what",
    "who",
    "where",
    "how",
    "on",
    "at",
    "with",
    "for",
    "to",
    "from",
    "in",
    "of",
    "we",
    "our",
    "my",
    "your",
    "their",
    "his",
    "her",
    "there",
    "then",
    "so",
    "as",
    "by",
    "not",
    "no"
  ],
  "suffixes": [
    "s",
    "er",
    "ers"
  ],
  "prefixes": [],
  "sentenceEnds": [
    ". ",
    "? ",
    "! "
  ],
  "scaleWords": [
    "k",
    "K",
    "m",
    "M",
    "bn",
    "million",
    "billion",
    "thousand"
  ],
  "phoneTrunks": [
    "0"
  ]
}
