{
  "$schema": "./language.schema.json",
  "code": "nl",
  "name": "Nederlands",
  "stopwords": [
    "de",
    "het",
    "een",
    "als",
    "en",
    "of",
    "maar",
    "dat",
    "dit",
    "die",
    "deze",
    "wij",
    "we",
    "ik",
    "je",
    "jij",
    "u",
    "zij",
    "ze",
    "hij",
    "wat",
    "wie",
    "waar",
    "hoe",
    "in",
    "op",
    "met",
    "van",
    "voor",
    "naar",
    "bij",
    "uit",
    "om",
    "tot",
    "ook",
    "niet",
    "geen",
    "er",
    "nu",
    "dan",
    "zo",
    "ons",
    "onze",
    "mijn",
    "jouw",
    "hun",
    "haar",
    "zijn",
    "door",
    "over",
    "aan"
  ],
  "suffixes": [
    "s",
    "se",
    "sche",
    "er",
    "ers",
    "mer",
    "mers"
  ],
  "prefixes": [],
  "sentenceEnds": [
    ". ",
    "? ",
    "! "
  ],
  "scaleWords": [
    "k",
    "K",
    "m",
    "M",
    "mln",
    "mio",
    "mld",
    "mrd",
    "miljoen",
    "miljard",
    "duizend"
  ],
  "phoneTrunks": [
    "0"
  ]
}
